{"$schema":"https://json-schema.org/draft/2020-12/schema","$id":"kalshi_phase6_readiness_lock.schema.json","title":"KalshiPhase6ReadinessLock","description":"Phase 5F — Phase 6 readiness lock. Locked. No Phase 6 unlock. No live mode.","type":"object","additionalProperties":false,"required":["kalshi_phase6_readiness_lock_id","schema_version","generated_at","phase","readiness_lock_status","upstream_operator_signoff_id","upstream_signoff_schema_version","unlock_requirements","safety_flags","forbidden_capabilities","allowed_outputs","forbidden_outputs","reason_code","reason"],"properties":{"kalshi_phase6_readiness_lock_id":{"type":"string","pattern":"^kp6rl_[a-f0-9]{32}$"},"schema_version":{"const":"kalshi_phase6_readiness_lock.v1"},"generated_at":{"type":"string","format":"date-time"},"phase":{"const":"Phase 5F"},"readiness_lock_status":{"enum":["locked","blocked"]},"upstream_operator_signoff_id":{"type":"string","pattern":"^kosc_[a-f0-9]{32}$"},"upstream_signoff_schema_version":{"const":"kalshi_operator_signoff_contract.v1"},"unlock_requirements":{"type":"array","items":{"type":"string"},"minItems":1},"safety_flags":{"type":"object","additionalProperties":false,"required":["paper_only","phase_6_ready","live_mode_allowed","order_placement_allowed","credentials_allowed","autonomous_execution_allowed","gates_passed","operator_signoff_complete"],"properties":{"paper_only":{"const":true},"phase_6_ready":{"const":false},"live_mode_allowed":{"const":false},"order_placement_allowed":{"const":false},"credentials_allowed":{"const":false},"autonomous_execution_allowed":{"const":false},"gates_passed":{"const":false},"operator_signoff_complete":{"const":false}}},"forbidden_capabilities":{"type":"array","items":{"type":"string"},"minItems":1},"allowed_outputs":{"type":"array","items":{"type":"string"},"minItems":1},"forbidden_outputs":{"type":"array","items":{"type":"string"},"minItems":1},"reason_code":{"const":"PHASE_6_LOCKED"},"reason":{"type":"string","minLength":1}}}
