{
  "kalshi_phase6_readiness_lock_id": "kp6rl_66f68638efe579a59157de64ad82386e",
  "schema_version": "kalshi_phase6_readiness_lock.v1",
  "generated_at": "2026-05-14T00:00:00Z",
  "phase": "Phase 5F",
  "readiness_lock_status": "locked",
  "upstream_operator_signoff_id": "kosc_653100807ed68b607437bd2f9ce33aea",
  "upstream_signoff_schema_version": "kalshi_operator_signoff_contract.v1",
  "unlock_requirements": [
    "all_gates_passed",
    "operator_signoff_complete",
    "risk_governor_implemented",
    "manual_approval_obtained"
  ],
  "safety_flags": {
    "paper_only": true,
    "phase_6_ready": false,
    "live_mode_allowed": false,
    "order_placement_allowed": false,
    "credentials_allowed": false,
    "autonomous_execution_allowed": false,
    "gates_passed": false,
    "operator_signoff_complete": false
  },
  "forbidden_capabilities": [
    "live_trading",
    "order_placement",
    "credentials",
    "api_keys",
    "autonomous_execution",
    "phase_6_unlock",
    "live_mode_enablement"
  ],
  "allowed_outputs": [
    "lock_status_report",
    "unlock_requirement_checklist"
  ],
  "forbidden_outputs": [
    "phase_6_approval",
    "live_orders",
    "credentials",
    "unlock_token"
  ],
  "reason_code": "PHASE_6_LOCKED",
  "reason": "phase 6 locked; all gates blocked; operator signoff not complete; paper mode remains blocked"
}
